No,Group,Post URL,Message,Score,Reason,PostDate (UTC+7),Contact,ScrapedAt (UTC+7)
27,"429829328127055","https://www.facebook.com/groups/429829328127055/posts/1605819337194709/"," ชุดปั๊มหอยโข่งโซล่าเซลล์ Handuro AC/DC 750w 1100w 1500w 2200w 1.5” 2” 3” 4” ชุดพร้อมใช้ปั๊มโซล่าเซลล์
ชุดปั๊มหอยโข่ง 2 ระบบ ชุดปั๊มโซล่าเซลล์ แฮนดูโร่
 ขายในราคา ฿12,000  บาท
สั่งซื้อ https://s.shope",0,"ผู้โพสต์เป็นผู้ขายชุดปั๊มหอยโข่งโซล่าเซลล์ (ราคา 12,000 บาท) มีลิงก์สั่งซื้อสินค้า ไม่ใช่ผู้ต้องการซื้อหรือติดตั้ง","2026-04-27 08:33","","2026-04-27 10:33:52"
28,"429829328127055","https://www.facebook.com/groups/429829328127055/posts/1604980507278592/","อรุณสวัสดิ์! มาเริ่มสร้างสังคมที่ดีไปด้วยกันเถอะ",0,"โพสต์ทั่วไปทักทายและพูดถึงการสร้างสังคมที่ดี ไม่มีความสนใจในการซื้อหรือติดตั้งโซลาร์เซลล์","ผู้ดูแล
 
3 ชั่วโมง","","2026-04-27 10:33:52"
29,"429829328127055","https://www.facebook.com/groups/429829328127055/posts/1605780023865307/","240W แผงละ 499 บาท... ดูเพิ่มเติม",0,"ผู้โพสต์เป็นผู้ขายแผงโซลาร์เซลล์ ราคา 499 บาทต่อแผง ไม่ใช่ผู้ที่ต้องการซื้อหรือติดตั้ง","2026-04-27 07:33","","2026-04-27 10:33:52"
