No,Group,Post URL,Message,Score,Reason,PostDate (UTC+7),Contact,ScrapedAt (UTC+7)

"=== BUYER LEADS ==="

1,"2317142971864047","https://www.facebook.com/groups/2317142971864047/posts/4359385717639752/","สอบถาม จะติดโซลล่าบนหลังคาจอดรถ แต่ไม่ชัวร์ว่าโดนตึก, ต้นไม้ บังมั๊ย
พอจะมีอุปกรณ์ตรวจสอบแสงแดดก่อนติดตั้งหรือไม่ครับ
กรณีถ้าเลี่ยงเงาบังบางช่วงเวลาไม่ได้ ควรจะติดแบบไหนดีครับ?",7,"ผู้โพสต์สนใจติดตั้งโซลาร์เซลล์บนหลังคาจอดรถ แสดงเจตนาชัดเจนว่าต้องการซื้อและติดตั้ง ถามเรื่องการตรวจสอบแสงแดดก่อนติดตั้งและวิธีการติดตั้งในกรณีที่มีเงาบัง ยังอยู่ในขั้นตอนศึกษาข้อมูลเพิ่มเติม","2026-04-27 10:32","","2026-04-27 10:33:52"
2,"thaisolarcell","https://www.facebook.com/groups/thaisolarcell/posts/1298868955546500/","ช่วงนี้คนสนใจติดโซลาร์เซลล์กันเยอะ เข้าใจว่าแต่ละที่ยุ่ง ส่งถามไป 10ที่ ตอบมา 3 ที่ 

เลยอยากขอรีวิวเพื่อนๆที่ติดแล้ว หรือมัดจำไปแล้ว บริการของที่ไหนดีบ้างขอบริษัทที่อยู่ใน กทม นนทบุรี",8,"ผู้โพสต์สนใจติดตั้งโซลาร์เซลล์อย่างชัดเจน กำลังเปรียบเทียบบริการจากหลายบริษัท ส่งคำถามไป 10 ที่ และมัดจำไปแล้วบางส่วน แสดงว่าพร้อมตัดสินใจสูง","2026-04-26 16:33","","2026-04-27 10:33:52"
3,"thaisolarcell","https://www.facebook.com/groups/thaisolarcell/posts/1298997635533632/","ต้องการติดตั้งโซลาร์เซลล์+แบต ครับ
กำลังดูไว้เป็น ชุด 5 kWh 1 เฟส + แบต 16 kW
ใช้ไฟกลางคืนส่วนใหญ่ครับ
ปกติค่าไฟประมาณ 3000-4000 บาท/เดือน
ดูเพิ่มเติม",9,"ต้องการติดตั้งโซลาร์เซลล์พร้อมแบตเตอรี่อย่างชัดเจน มีค่าไฟระดับ 3000-4000 บาท/เดือน (เหมาะกับการลงทุน) ใช้ไฟกลางคืนเป็นหลัก (เหมาะกับระบบแบตเตอรี่) ระบุสเปคที่ต้องการชัดเจน (5 kWh 1 เฟส + แบต 16 kW) แสดงถึงความพร้อมในการซื้อสูง","2026-04-26 20:33","","2026-04-27 10:33:52"
4,"thaisolarcell","https://www.facebook.com/groups/thaisolarcell/posts/1299541712145891/","อยากติดโซล่า
ใช้แอร์ 2 ตัว ตู้เย็น 1 รถEV
ใช้ระบบไหนดีครับ
ค่าไช้จ่ายประมาณเท่าไหร่คับ 5kw+
ขอบคุณไว้ล่วงหน้าครับ",9,"ผู้โพสต์แสดงความต้องการชัดเจนว่าอยากติดโซล่าร์ (ติดตั้ง) มีข้อมูลการใช้ไฟฟ้าที่เฉพาะเจาะจง (แอร์ 2 ตัว ตู้เย็น รถ EV) และถามเกี่ยวกับระบบที่เหมาะสมพร้อมงบประมาณ 5kw+ บ่งบอกว่าอยู่ในขั้นตอนเปรียบเทียบราคาและพร้อมตัดสินใจซื้อ","2026-04-27 10:30","","2026-04-27 10:33:52"
5,"thaisolarcell","https://www.facebook.com/groups/thaisolarcell/posts/1298326902267372/","คนที่ติดโซล่าเซลไปแล้วรีวิวหน่อยค่ะว่าใช้แบรนด์ไหนกันบ้าง พอดีมีแพลนจะติดแต่ลังเลว่าควรเลือกแบบไหน แบรนด์ไหนดีคะ",8,"ผู้โพสต์มีแผนจะติดตั้งโซล่าเซลล์และกำลังหารีวิวเปรียบเทียบแบรนด์ อยู่ในขั้นตอนพิจารณาซื้อ พร้อมตัดสินใจสูง","2026-04-26 10:33","","2026-04-27 10:33:52"
6,"thaisolarcell","https://www.facebook.com/groups/thaisolarcell/posts/1298916208875108/","หาบริษัทที่น่าเชื่อถือ ติดตั้งโซล่าเซลอยากได้inverter :Huawei
ในกทม ค่าไฟประมาณ 4,500-6,500 บาท/เดือนครับ
รายละเอีนดใช้ไฟ ในคอมเม้น",9,"ต้องการติดตั้งโซล่าเซลล์ ระบุแบรนด์ Inverter ที่ต้องการ (Huawei) บอกค่าไฟต่อเดือน (4,500-6,500 บาท) และพื้นที่ (กรุงเทพฯ) ขอหาบริษัทที่น่าเชื่อถือ → พร้อมซื้อและติดตั้งสูง","2026-04-26 18:33","","2026-04-27 10:33:52"
7,"429829328127055","https://www.facebook.com/groups/429829328127055/posts/1605886363854673/"," ค่าไฟแพงแบบนี้…ต้องรีบติดโซล่าเซลล์... ดูเพิ่มเติม",9,"ผู้投稿 expressing need และ urgency ในการติดตั้งโซล่าเซลล์เนื่องจากค่าไฟแพง มีเจตนาชัดเจนในการซื้อ/ติดตั้ง","2026-04-27 10:22","","2026-04-27 10:33:52"



"=== NOT BUYER LEADS (Filtered Out) ==="

1,"1925997401002801","https://www.facebook.com/groups/1925997401002801/posts/4527415850860930/","บริษัท เอราวัณ โซล่าร์ รับสมัครพนักงานติดตั้ง 1 ตำแหน่ง(ชาย)
****-วิศวกร งานติดตั้งระบบไฟฟ้า/โซล่าร์ 18,000-28,000 บาท/เดือน (มีประสบการณ์)***
****-ช่างติดตั้งระบบโซล่าร์ บ้าน/โรงงาน 3 ตำแหน่ง(ชาย) ค่",0,"Error: The read operation timed out","2026-04-27 10:32","","2026-04-27 10:33:52"
2,"1925997401002801","https://www.facebook.com/groups/1925997401002801/posts/4527414054194443/","#ติดตั้งแผงโซล่าเซลล์ #SolarRooftop #ประหยัดค่าไฟ #พลังงานแสงอาทิตย์",2,"เป็นการโพสต์แฮชแท็กทั่วไปเกี่ยวกับโซล่าเซลล์ ไม่มีสัญญาณว่าผู้โพสต์ต้องการซื้อหรือติดตั้ง อาจเป็นผู้ขายหรือคนที่แชร์ข้อมูลทั่วไป","2026-04-27 10:30","","2026-04-27 10:33:52"
3,"1925997401002801","https://www.facebook.com/groups/1925997401002801/posts/4527397097529472/","สนใจแผงโซล่าเซลล์Aiko 
สินค้ามีพร้อมส่ง Aiko650w ค่ะ
สั่งซื้อสอบถามติดต่อเกได้เลยค่ะ
โทร.065-9569689   
แอดไลน์ID gaga 65
สนใจแผงโซล่าเซลล์Aiko ... ดูเพิ่มเติม",0,"ผู้โพสต์เป็นผู้ขายแผงโซล่าเซลล์ Aiko โฆษณาสินค้าพร้อมส่งและแสดงเบอร์ติดต่อซื้อขาย ไม่ใช่ผู้สนใจซื้อหรือติดตั้ง","2026-04-27 10:06","","2026-04-27 10:33:52"
4,"1925997401002801","https://www.facebook.com/groups/1925997401002801/posts/4527410104194838/","ลิเธียม 3.2v 314Ah *** สินค้าใหม่ ในราคา ฿9,990ที่ Shopee
พิกัดลิงก์
https://s.shopee.co.th/BQBrByg1q",0,"ผู้โพสต์เป็นผู้ขายสินค้า (ลิเธียมแบตเตอรี่) บน Shopee ไม่ใช่ผู้ต้องการซื้อหรือติดตั้งโซลาร์เซลล์","2026-04-27 10:24","","2026-04-27 10:33:52"
5,"1925997401002801","https://www.facebook.com/groups/1925997401002801/posts/4527409367528245/","THAI UNION... ดูเพิ่มเติม",0,"โพสต์ไม่เกี่ยวข้องกับการซื้อหรือติดตั้งโซลาร์เซลล์","2026-04-27 10:23","","2026-04-27 10:33:52"
6,"1925997401002801","https://www.facebook.com/groups/1925997401002801/posts/4527406350861880/","สต๊อกแผงโซล่าเซลล์ 600W RAPD แบบจุกๆ 80 เรท
✅ ราคาปลีก
✅ ราคาส่ง... ดูเพิ่มเติม",0,"ผู้โพสต์เป็นผู้ขายแผงโซล่าเซลล์ มีการแจ้งราคาปลีกและราคาส่ง ไม่ใช่ผู้ที่ต้องการซื้อหรือติดตั้งแผงโซล่าเซลล์","2026-04-27 10:18","","2026-04-27 10:33:52"
7,"383849116272497","https://www.facebook.com/groups/383849116272497/posts/1659722728685123/"," แผงโซลาร์เซลล์ 245W มือสอง สภาพสวย ใช้งานได้จริง 
  ... ดูเพิ่มเติม",0,"ผู้โพสต์เป็นผู้ขายแผงโซลาร์เซลล์มือสอง ไม่ได้แสดงความต้องการซื้อหรือติดตั้ง","2026-04-26 10:33","","2026-04-27 10:33:52"
8,"2317142971864047","https://www.facebook.com/groups/2317142971864047/posts/4359386304306360/","ขออนุญาตแอดมินค่ะ
มีแผงโซล่าเซลล์พร้อมส่งค่ะ Aiko650w
4.8-4.9 /w 3,120-3,185 ต่อแผง
ราคาไม่รวมvat. ไม่รวมส่งค่ะ
ค่าขนส่งคิดตามระยะทาง
ดูเพิ่มเติม",0,"ผู้โพสต์เป็นผู้ขายแผงโซล่าเซลล์ Aiko 650w ระบุราคาและสภาพพร้อมส่ง ชัดเจนว่าเป็นผู้ขายไม่ใช่ผู้ต้องการซื้อหรือติดตั้ง","2026-04-27 10:32","","2026-04-27 10:33:52"
9,"2317142971864047","https://www.facebook.com/groups/2317142971864047/posts/4359383960973261/","ยินดีกับลูกค้าโซล่าเชลล์บ้านด้วยนะครับ ธนาคารอนุมัติแล้วครับ",0,"โพสต์โดยผู้ขายโซล่าเซลล์ที่กำลังฉลองลูกค้าที่ธนาคารอนุมัติสินเชื่อแล้ว เป็นการประกาศขายไม่ใช่ผู้ที่ต้องการซื้อ","2026-04-27 10:30","","2026-04-27 10:33:52"
10,"2317142971864047","https://www.facebook.com/groups/2317142971864047/posts/4359382684306722/"," ล้างแผงตรวจเช็คระบบให้การทำงานมีประสิทธิภาพดีขึ้น
#กระบี่โซล่าเซลล์ตรงข้ามไปรษณีย์เหนือคลอง
#งานล้างแผงตรวจเช็คระบบ
#พลังงานทางเลือกพลังงานทางรอด
#ติดตั้งก่อนประหยัดก่อน
ดูเพิ่มเติม",0,"โพสต์นี้เป็นการโฆษณาบริการล้างแผงและตรวจเช็คระบบของบริษัทโซลาร์เซลล์ ไม่ใช่ผู้ที่ต้องการซื้อหรือติดตั้งแผงโซลาร์","2026-04-27 10:29","","2026-04-27 10:33:52"
11,"2317142971864047","https://www.facebook.com/groups/2317142971864047/posts/4359381857640138/","แบตเตอรี่สำรองไฟ
ถอดจากเครื่องสำรองไฟ ใช้งานแค่ 1 ปี
Energetic 12V 200ah. หนัก 60 kg.
ขนาด L240×W522xH218 mm.
ราคาลูกละ 3500 บาท 
ว่าง 2 ลูกค่ะ
ดูเพิ่มเติม",0,"ผู้โพสต์เป็นผู้ขายแบตเตอรี่สำรองไฟ ไม่ใช่ผู้ต้องการซื้อหรือติดตั้งโซลาร์เซลล์","2026-04-27 10:28","","2026-04-27 10:33:52"
12,"2317142971864047","https://www.facebook.com/groups/2317142971864047/posts/4359377107640613/","สอบถามครับ
ทำไมโหลดที่บ้านมันถึง ขึ้น ลง ทั้งที่เปิดแอร์ตัวเดิม เท่าเดิม และ grid ยังจ่ายไฟตลอด",1,"ผู้ใช้สอบถามเรื่องการใช้ไฟฟ้าภายในบ้าน ไม่มีความต้องการซื้อหรือติดตั้งโซลาร์เซลล์","2026-04-27 10:22","","2026-04-27 10:33:52"
13,"2317142971864047","https://www.facebook.com/groups/2317142971864047/posts/4359376190974038/","เอารถจักรยานไฟฟ้าไปแลกแผง245w.มาได้ 3 แผงแบตจากพี่ชายใจดีในโลกโซเชียล 2 ลูก 3,... ดูเพิ่มเติม",0,"Parse error","2026-04-27 10:20","","2026-04-27 10:33:52"
14,"thaisolarcell","https://www.facebook.com/groups/thaisolarcell/posts/1299541452145917/","ยินดีกับลูกค้าโซล่าเชลล์บ้านด้วยนะครับ ธนาคารอนุมัติแล้วครับ",0,"โพสต์นี้เป็นการแจ้งข่าวจากผู้ขายว่าธนาคารอนุมัติสินเชื่อให้ลูกค้าโซล่าเซลล์ ไม่ได้แสดงความต้องการซื้อหรือติดตั้ง","2026-04-27 10:29","","2026-04-27 10:33:52"
15,"thaisolarcell","https://www.facebook.com/groups/thaisolarcell/posts/1299539572146105/","ขออนุญาตแอดมินค่ะ
อัพเดทงานติดตั้งของบริษัท Sigenergy บ้านคุณตี๋ บางบอนค่ะ
ติดโซล่าเซลล์กับนิด คุ้มค่า คุ้มราคาแน่นอนค่ะ
ช่องทางการติดต่อ:
ดูเพิ่มเติม",0,"โพสต์นี้เป็นการโฆษณาบริการติดตั้งโซล่าเซลล์ของผู้ขาย/ผู้ให้บริการ ไม่ใช่ผู้ที่ต้องการซื้อหรือติดตั้งโซล่าเซลล์สำหรับตัวเอง","2026-04-27 10:26","","2026-04-27 10:33:52"
16,"thaisolarcell","https://www.facebook.com/groups/thaisolarcell/posts/1299483532151709/","เดี๋ยวนี้ติดกล้องวงจรปิดไม่ต้องต่อระบบไฟให้ยุ่งยากแล้วค่ะ ใช้ระบบโซล่าเซลล์แบบ... ดูเพิ่มเติม",0,"ผู้โพสต์เป็นผู้ขาย/ผู้ประกอบการกำลังโปรโมทสินค้ากล้องวงจรปิดพลังงานแสงอาทิตย์ ไม่ใช่ผู้ต้องการซื้อหรือติดตั้งระบบโซล่าเซลล์","2026-04-27 09:33","","2026-04-27 10:33:52"
17,"thaisolarcell","https://www.facebook.com/groups/thaisolarcell/posts/1292423836191012/","ซื้อคืน 2 บาท ขายออก 5 บาท ไม่ต้องทำเลยนะ ควรให้หักลบกันได้ในระบบไปเลย โซลาร์เซลล์บ้านที่บอกว่า ""ขายไฟได้"" ฟังดูดี แต่ต้องควักกี่แสนกว่าจะคืนทุน?
""เอกนิติ"" ขึ้นเวที IMF ที่วอชิงตัน ประกาศแผนเปิดให้ชาว",1,"ผู้โพสต์กำลังวิพากษ์เศรษฐกิจของโซลาร์เซลล์บ้านและตั้งคำถามเรื่องค่าใช้จ่ายที่ต้องควักก่อนคืนทุน ไม่ได้แสดงความต้องการซื้อหรือติดตั้ง แต่เป็นการสนทนาเรื่องนโยบายและความคุ้มค่า","","","2026-04-27 10:33:52"
18,"thaisolarcell","https://www.facebook.com/groups/thaisolarcell/posts/1298934505539945/","หาช่างมีผลงานทำโซล่าเซลล์อาคาร 10kw 28 โครงการในขอนแก่น,ชัยภูมิ
0644495288 วันธรรมดา",0,"Error: The read operation timed out","2026-04-26 18:33","","2026-04-27 10:33:52"
19,"1671213103178339","https://www.facebook.com/groups/1671213103178339/posts/4067318576901101/","ร้านโอเคแบตเตอรี่สาขาอู่ทอง
จำหน่ายแบตมือหนึ่ง และ แบตมือสอง
3K -MAX2500  ขั้ว L แบตปี68เดือน9
รับประกัน 6 เดือน โทรสอบถาม 092-279-8906 ร้านอยู่อู่ทอง",0,"โพสต์เป็นร้านขายแบตเตอรี่ ไม่เกี่ยวข้องกับการซื้อหรือติดตั้งแผงโซลาร์เซลล์ จึงไม่ถือว่าเป็นลูกค้าที่สนใจ","2026-04-27 09:33","","2026-04-27 10:33:52"
20,"1671213103178339","https://www.facebook.com/groups/1671213103178339/posts/4066432803656345/","ขายแผงโซลาเซลค่ะ มีอยู่ 2 ชิ้น ใครสนใจทักมาสอบถามได้เลยนะคะ อยู่แถวบางนา หรือจะส่งลาล่ามูฟก็ได้ค่ะ ของไม่มีตำหนิไม่เคยใช้  สภาพใหม่ ราคาเต็มอยู่ที่ 5,xxx สามารถเช็คได้เลยค่ะ ยี่ห้อ Sunman",0,"ผู้โพสต์เป็นผู้ขายแผงโซลาร์เซลล์ (ขายแผงโซลาเซลค่ะ) ไม่ได้ต้องการซื้อหรือติดตั้ง จึงไม่ใช่ลูกค้าเป้าหมาย","2026-04-26 12:33","","2026-04-27 10:33:52"
21,"1671213103178339","https://www.facebook.com/groups/1671213103178339/posts/4061443357488623/","TRINA SOLAR
ซื้อจำนวนเยอะ
EPC
มีราคาพิเศษ... ดูเพิ่มเติม",0,"ผู้โพสต์เป็นผู้ขาย/ตัวแทน TRINA SOLAR ที่อ้างขายสินค้าจำนวนมากและมีราคาพิเศษ ไม่ใช่ผู้ต้องการซื้อหรือติดตั้งระบบโซลาร์","2026-04-21 10:33","","2026-04-27 10:33:52"
22,"1671213103178339","https://www.facebook.com/groups/1671213103178339/posts/4063460377286921/","มาๆมาแล้ว  แผงมือ 2  ที่คุณอยากได้  ราคาถูก !!  แผง 310 w มือ2  ใช้สูบน้ำ ปั้ม... ดูเพิ่มเติม",0,"ผู้โพสต์เป็นผู้ขายแผงโซลาร์เซลล์มือสอง (second-hand) ราคาถูก ระบุว่าขายแผง 310w มือสอง สำหรับสูบน้ำ ปั้ม ไม่ใช่ผู้ต้องการซื้อหรือติดตั้งระบบโซลาร์เซลล์","2026-04-24 10:33","","2026-04-27 10:33:52"
23,"1671213103178339","https://www.facebook.com/groups/1671213103178339/posts/4064509743848651/","สตูดิโอ 0 ห้องน้ำ - อพาร์ทเมนท์
โฮมโปร, ถนน เทพกษัตรี, ศรีสุนทร, ถลาง, ภูเก็ต 83110, ประเทศไทย
 ด่วน! ที่ดินทำเลทอง ติดถนนใหญ่ ใกล้ HomePro ถลาง ภูเก็ต... ดูเพิ่มเติม",0,"โพสต์นี้เป็นเรื่องอสังหาริมทรัพย์ (อพาร์ทเมนท์และที่ดินขาย/ให้เช่า) ไม่เกี่ยวข้องกับการติดตั้งโซลาร์เซลล์","2026-04-25 10:33","","2026-04-27 10:33:52"
24,"429829328127055","https://www.facebook.com/groups/429829328127055/posts/1605842747192368/","แผงโซล่าเซลล์ 245 วัตต์ มือ2
สภาพสวย พร้อมใช้งาน
[
ของมีจำนวนจำกัด
]
ราคา550/แผง
ซื้อ10แผงขึ้นไป เหลือ530/แผง
ดูเพิ่มเติม",0,"ผู้โพสต์เป็นผู้ขายแผงโซล่าเซลล์มือสอง ระบุราคาและเงื่อนไขการซื้อขายชัดเจน ไม่ใช่ผู้ที่ต้องการซื้อหรือติดตั้งระบบโซล่าเซลล์","2026-04-27 09:33","","2026-04-27 10:33:52"
25,"429829328127055","https://www.facebook.com/groups/429829328127055/posts/1605838023859507/","Deye Micro Inverter 1.6kW/2.25kW พร้อม Rapid Shutdown Build in AFCI  - ประกัน ... ดูเพิ่มเติม",0,"โพสต์เป็นโฆษณาขายอุปกรณ์ Solar ของผู้ขาย ไม่ได้แสดงความต้องการซื้อหรือติดตั้ง","2026-04-27 09:33","","2026-04-27 10:33:52"
26,"429829328127055","https://www.facebook.com/groups/429829328127055/posts/1605825563860753/"," ถูกจริง ใช้ได้จริง! ใครหาโซล่าเซลล์อยู่ ห้ามพลาดตัวนี้
 แผงโซลาร์เซลล์ 245W มือ 2 หน้าใส
 สภาพสวย คัดแล้วทุกแผง
 ไฟออกเต็ม ใช้งานได้จริง ไม่ต้องลุ้น
ดูเพิ่มเติม",0,"ผู้โพสต์เป็นผู้ขายแผงโซลาร์เซลล์มือสอง ไม่ใช่ผู้ต้องการซื้อ/ติดตั้ง","2026-04-27 09:33","","2026-04-27 10:33:52"
