No,Post URL,Message,Score,Reason,Group,PostDate,Contact,ScrapedAt
1,https://www.facebook.com/groups/2317142971864047/posts/4353130981598559/,Hybrid Solar 10kw มีแบต 7kw ขอเปลี่ยนมิเตอร์เป็น tou จะดีกว่าแบบปกติไหมครับ ในกรณีครอบคลุมและประหยัดค่าไฟ,2,สนใจโซล่าเซลล์,2317142971864047,4 นาที,,2026-04-21 14:49:05
2,https://www.facebook.com/groups/2317142971864047/posts/4353130981598559/,Hybrid Solar 10kw มีแบต 7kw ขอเปลี่ยนมิเตอร์เป็น tou จะดีกว่าแบบปกติไหมครับ ในกรณีครอบคลุมและประหยัดค่าไฟ,2,ต้องการรีวิวเปรียบเทียบ,2317142971864047,9 นาที,,2026-04-21 14:54:17
3,https://www.facebook.com/groups/1925997401002801/posts/4521452764790572/,ราคาจะปรับขึ้นแล้วรีบตัดสินใจกันน่ะ... ดูเพิ่มเติม,10,กำลังจะซื้อ/ติด,1925997401002801,1 ชั่วโมง,,2026-04-21 15:11:16
4,https://www.facebook.com/groups/2317142971864047/posts/4353140561597601/,แอร์ inverter 18000BTU ถ้าจะติดแผงโซลาน์เซลล์ ทำเองหรือจ้างแบบเป็นชุด  ราคาเท่าไหร่หรอครับ,10,กำลังจะซื้อ/ติด,2317142971864047,14 นาที,,2026-04-21 15:11:31
5,https://www.facebook.com/groups/thaisolarcell/posts/1294725442627518/,"รบกวนขอคำแนะนำครับ ตอนนี้ใช้ inverter huawei 5 kw + แผง 500w 12 แผง  เป็นระบบ hybrid ไม่มีแบต ตอนนี้กำลังจะหาแบตมาใส่ ลังเลว่าจะไปทางไหนดี 
1.ซื้อแบต luna2000 2 ก้อน + power module ใช้ประมานงบ 160,000+-
2.เปลี่ยน inverter แบรนด์อื่น + แบต ประมาน 16 kw. โดยใช้แผงเดิม ในงบ ใกล้เคียง ... ดูเพิ่มเติม",10,สอบถาม/ขอคำแนะนำ,thaisolarcell,2 ชั่วโมง,,2026-04-21 15:11:42
6,https://www.facebook.com/groups/thaisolarcell/posts/1294543235979072/,"รบกวนขอรีวิวบ้านไหนติดของ energy lib มั้ยคะ
บริการหลังการขายเป็นยังไง สินค้าโอเคมั้ย
กำลังลังเลอยู่ว่าจะไป huawei ดีมั้ยค่ะ
ขอบคุณนะคะ",4,สอบถาม/ขอคำแนะนำ,thaisolarcell,7 ชั่วโมง,,2026-04-21 15:11:46
7,https://www.facebook.com/groups/1671213103178339/posts/4061617280804564/,"อินเวอร์เตอร์ แปลงไฟ 12 V เป็น 220 V ขนาด 3,000 วัตต์... ดูเพิ่มเติม",6,ถามเกี่ยวกับโซล่า,1671213103178339,3 ชั่วโมง,,2026-04-21 15:12:07
8,https://www.facebook.com/groups/thaisolarcell/posts/1290343156399080/,สนใจติด6k แบต16k เสนอราคาใต้โพสพร้อมสเปคค่ะ,6,สนใจ/กำลังพิจารณา,thaisolarcell,5 วัน,,2026-04-21 15:12:09
9,https://www.facebook.com/groups/1925997401002801/posts/4521494674786381/,"DEYE Micro Inverter 2.25 Kw build-in wifi and rapid shutdown warranty 10 years รองรับแผงสูงสุด4แผง ผ่านลิสการไฟฟ้า
 https://s.shopee.co.th/16cNevJQO",4,ถามเกี่ยวกับโซล่า,1925997401002801,2 นาที,,2026-04-21 15:13:50
10,https://www.facebook.com/groups/2317142971864047/posts/4353140561597601/,แอร์ inverter 18000BTU ถ้าจะติดแผงโซลาน์เซลล์ ทำเองหรือจ้างแบบเป็นชุด  ราคาเท่าไหร่หรอครับ,10,กำลังจะซื้อ/ติด,2317142971864047,16 นาที,,2026-04-21 15:14:19
11,https://www.facebook.com/groups/thaisolarcell/posts/1290343156399080/,สนใจติด6k แบต16k เสนอราคาใต้โพสพร้อมสเปคค่ะ,6,สนใจ/กำลังพิจารณา,thaisolarcell,5 วัน,,2026-04-21 15:14:34
12,https://www.facebook.com/groups/thaisolarcell/posts/1294725442627518/,"รบกวนขอคำแนะนำครับ ตอนนี้ใช้ inverter huawei 5 kw + แผง 500w 12 แผง  เป็นระบบ hybrid ไม่มีแบต ตอนนี้กำลังจะหาแบตมาใส่ ลังเลว่าจะไปทางไหนดี 
1.ซื้อแบต luna2000 2 ก้อน + power module ใช้ประมานงบ 160,000+-
2.เปลี่ยน inverter แบรนด์อื่น + แบต ประมาน 16 kw. โดยใช้แผงเดิม ในงบ ใกล้เคียง ... ดูเพิ่มเติม",10,สอบถาม/ขอคำแนะนำ,thaisolarcell,2 ชั่วโมง,,2026-04-21 15:14:46
13,https://www.facebook.com/groups/thaisolarcell/posts/1294543235979072/,"รบกวนขอรีวิวบ้านไหนติดของ energy lib มั้ยคะ
บริการหลังการขายเป็นยังไง สินค้าโอเคมั้ย
กำลังลังเลอยู่ว่าจะไป huawei ดีมั้ยค่ะ
ขอบคุณนะคะ",4,สอบถาม/ขอคำแนะนำ,thaisolarcell,7 ชั่วโมง,,2026-04-21 15:14:49
14,https://www.facebook.com/groups/1925997401002801/posts/4521494674786381/,"DEYE Micro Inverter 2.25 Kw build-in wifi and rapid shutdown warranty 10 years รองรับแผงสูงสุด4แผง ผ่านลิสการไฟฟ้า
 https://s.shopee.co.th/16cNevJQO",4,ถามเกี่ยวกับโซล่า,1925997401002801,19 นาที,,2026-04-21 15:30:12
15,https://www.facebook.com/groups/2317142971864047/posts/4353153071596350/,หาช่างติดกันย้อน อินเวอร์เตอร์ invt ระแวกพุทธมณฑล คลองโยง,4,ถามเกี่ยวกับโซล่า,2317142971864047,14 นาที,,2026-04-21 15:30:22
16,https://www.facebook.com/groups/thaisolarcell/posts/1294725442627518/,"รบกวนขอคำแนะนำครับ ตอนนี้ใช้ inverter huawei 5 kw + แผง 500w 12 แผง  เป็นระบบ hybrid ไม่มีแบต ตอนนี้กำลังจะหาแบตมาใส่ ลังเลว่าจะไปทางไหนดี 
1.ซื้อแบต luna2000 2 ก้อน + power module ใช้ประมานงบ 160,000+-
2.เปลี่ยน inverter แบรนด์อื่น + แบต ประมาน 16 kw. โดยใช้แผงเดิม ในงบ ใกล้เคียง ... ดูเพิ่มเติม",10,สอบถาม/ขอคำแนะนำ,thaisolarcell,2 ชั่วโมง,,2026-04-21 15:30:57
17,https://www.facebook.com/groups/thaisolarcell/posts/1294667075966688/,ตอนนี้เล็งๆ อยากติดโซล่าเซลที่บ้านบ้าง แต่เลือกบริษัทไม่ถูก กลัวโดนขายฝันแล้วทิ้งงาน ใครมีบริษัทที่ใช้อยู่แล้วรู้สึกว่าบริการดี รับผิดชอบงานดี ช่วยแนะนำหน่อยนะคะ ขอบคุณล่วงหน้าค่ะ!,10,สนใจ/กำลังพิจารณา,thaisolarcell,4 ชั่วโมง,,2026-04-21 15:31:01
18,https://www.facebook.com/groups/thaisolarcell/posts/1290343156399080/,สนใจติด6k แบต16k เสนอราคาใต้โพสพร้อมสเปคค่ะ,6,สนใจ/กำลังพิจารณา,thaisolarcell,5 วัน,,2026-04-21 15:31:21
19,https://www.facebook.com/groups/2317142971864047/posts/4353171214927869/,"สอบถามครับ
แบตลิเทียม genixgreen ดีไหมครับ",4,สอบถาม/ขอคำแนะนำ,2317142971864047,2 นาที,,2026-04-21 15:37:14
20,https://www.facebook.com/groups/thaisolarcell/posts/1294800862619976/,บ้านเป็นตึกแถว 3 ชั้นครึ่ง 1 คูหา ดาดฟ้าเรียบๆ ไม่มีหลังคา มีแท้งน้ำ 1 แท้ง ค่าไฟ 6000+ กลางวันส่วนมากเปิดแอร์ 16000 btu 1 ตัว อยากติด Solar + แบต รบกวนแนะนำบริษัท ราคาไม่แรงทีครับ  ขอบคุณล่วงหน้าครับ,10,สนใจ/กำลังพิจารณา,thaisolarcell,1 นาที,,2026-04-21 15:37:52
21,https://www.facebook.com/groups/thaisolarcell/posts/1292001792899883/,"เปิดร้านขายของชำ อยากติดตั้งโซล่าเซล
เน้นใช้ไฟฟ้าตอนกลางวันเยอะครับ ค่าไฟ 5-6พันบาท
เครื่องใช้ไฟฟ้า แอร์ 24,000 / 2 เครื่อง เน้นกลางวัน
ตู้แช่เครื่องดื่ม 2 ประตู 2 เครื่อง เปิด 24ชั่วโมง
ดูเพิ่มเติม",10,สนใจ/กำลังพิจารณา,thaisolarcell,3 วัน,,2026-04-21 15:37:56
